No.     Time           Source                Destination           Protocol Length Info
     68 0.835714842    192.168.86.250        192.168.86.47         TCP      309    80 → 48802 [PSH, ACK] Seq=6682 Ack=2664 Win=2048 Len=255 [TCP segment of a reassembled PDU]

Frame 68: 309 bytes on wire (2472 bits), 309 bytes captured (2472 bits) on interface 0
Ethernet II, Src: 52:75:76:a7:f1:d9 (52:75:76:a7:f1:d9), Dst: IntelCor_e5:39:95 (0c:8b:fd:e5:39:95)
Internet Protocol Version 4, Src: 192.168.86.250, Dst: 192.168.86.47
Transmission Control Protocol, Src Port: 80, Dst Port: 48802, Seq: 6682, Ack: 2664, Len: 255

No.     Time           Source                Destination           Protocol Length Info
     69 0.845152655    192.168.86.250        192.168.86.47         HTTP     245    HTTP/1.1 200 OK  (application/json)

Frame 69: 245 bytes on wire (1960 bits), 245 bytes captured (1960 bits) on interface 0
Ethernet II, Src: 52:75:76:a7:f1:d9 (52:75:76:a7:f1:d9), Dst: IntelCor_e5:39:95 (0c:8b:fd:e5:39:95)
Internet Protocol Version 4, Src: 192.168.86.250, Dst: 192.168.86.47
Transmission Control Protocol, Src Port: 80, Dst Port: 48802, Seq: 6937, Ack: 2664, Len: 191
[2 Reassembled TCP Segments (446 bytes): #68(255), #69(191)]
Hypertext Transfer Protocol
JavaScript Object Notation: application/json

No.     Time           Source                Destination           Protocol Length Info
     70 0.845220614    192.168.86.47         192.168.86.250        TCP      54     48802 → 80 [ACK] Seq=2664 Ack=7128 Win=63784 Len=0

Frame 70: 54 bytes on wire (432 bits), 54 bytes captured (432 bits) on interface 0
Ethernet II, Src: IntelCor_e5:39:95 (0c:8b:fd:e5:39:95), Dst: 52:75:76:a7:f1:d9 (52:75:76:a7:f1:d9)
Internet Protocol Version 4, Src: 192.168.86.47, Dst: 192.168.86.250
Transmission Control Protocol, Src Port: 48802, Dst Port: 80, Seq: 2664, Ack: 7128, Len: 0

No.     Time           Source                Destination           Protocol Length Info
     71 0.846117064    192.168.86.47         192.168.86.250        HTTP     221    GET /management/v1/configureddevices?ClientID=7&ClientTransactionID=17 HTTP/1.1 

Frame 71: 221 bytes on wire (1768 bits), 221 bytes captured (1768 bits) on interface 0
Ethernet II, Src: IntelCor_e5:39:95 (0c:8b:fd:e5:39:95), Dst: 52:75:76:a7:f1:d9 (52:75:76:a7:f1:d9)
Internet Protocol Version 4, Src: 192.168.86.47, Dst: 192.168.86.250
Transmission Control Protocol, Src Port: 48802, Dst Port: 80, Seq: 2664, Ack: 7128, Len: 167
Hypertext Transfer Protocol

No.     Time           Source                Destination           Protocol Length Info
     72 0.886727870    192.168.86.250        192.168.86.47         TCP      309    80 → 48802 [PSH, ACK] Seq=7128 Ack=2831 Win=2048 Len=255 [TCP segment of a reassembled PDU]

Frame 72: 309 bytes on wire (2472 bits), 309 bytes captured (2472 bits) on interface 0
Ethernet II, Src: 52:75:76:a7:f1:d9 (52:75:76:a7:f1:d9), Dst: IntelCor_e5:39:95 (0c:8b:fd:e5:39:95)
Internet Protocol Version 4, Src: 192.168.86.250, Dst: 192.168.86.47
Transmission Control Protocol, Src Port: 80, Dst Port: 48802, Seq: 7128, Ack: 2831, Len: 255

No.     Time           Source                Destination           Protocol Length Info
     73 0.897290185    192.168.86.47         192.168.86.250        TCP      54     48802 → 80 [FIN, ACK] Seq=2831 Ack=7383 Win=63784 Len=0

Frame 73: 54 bytes on wire (432 bits), 54 bytes captured (432 bits) on interface 0
Ethernet II, Src: IntelCor_e5:39:95 (0c:8b:fd:e5:39:95), Dst: 52:75:76:a7:f1:d9 (52:75:76:a7:f1:d9)
Internet Protocol Version 4, Src: 192.168.86.47, Dst: 192.168.86.250
Transmission Control Protocol, Src Port: 48802, Dst Port: 80, Seq: 2831, Ack: 7383, Len: 0

No.     Time           Source                Destination           Protocol Length Info
     74 0.897295358    192.168.86.250        192.168.86.47         HTTP     245    HTTP/1.1 200 OK  (application/json)

Frame 74: 245 bytes on wire (1960 bits), 245 bytes captured (1960 bits) on interface 0
Ethernet II, Src: 52:75:76:a7:f1:d9 (52:75:76:a7:f1:d9), Dst: IntelCor_e5:39:95 (0c:8b:fd:e5:39:95)
Internet Protocol Version 4, Src: 192.168.86.250, Dst: 192.168.86.47
Transmission Control Protocol, Src Port: 80, Dst Port: 48802, Seq: 7383, Ack: 2831, Len: 191
[2 Reassembled TCP Segments (446 bytes): #72(255), #74(191)]
Hypertext Transfer Protocol
JavaScript Object Notation: application/json

No.     Time           Source                Destination           Protocol Length Info
     75 0.897318652    192.168.86.47         192.168.86.250        TCP      54     48802 → 80 [RST] Seq=2831 Win=0 Len=0

Frame 75: 54 bytes on wire (432 bits), 54 bytes captured (432 bits) on interface 0
Ethernet II, Src: IntelCor_e5:39:95 (0c:8b:fd:e5:39:95), Dst: 52:75:76:a7:f1:d9 (52:75:76:a7:f1:d9)
Internet Protocol Version 4, Src: 192.168.86.47, Dst: 192.168.86.250
Transmission Control Protocol, Src Port: 48802, Dst Port: 80, Seq: 2831, Len: 0

No.     Time           Source                Destination           Protocol Length Info
     76 0.898681722    192.168.86.250        192.168.86.47         TCP      60     80 → 48802 [ACK] Seq=7574 Ack=2832 Win=2048 Len=0

Frame 76: 60 bytes on wire (480 bits), 60 bytes captured (480 bits) on interface 0
Ethernet II, Src: 52:75:76:a7:f1:d9 (52:75:76:a7:f1:d9), Dst: IntelCor_e5:39:95 (0c:8b:fd:e5:39:95)
Internet Protocol Version 4, Src: 192.168.86.250, Dst: 192.168.86.47
Transmission Control Protocol, Src Port: 80, Dst Port: 48802, Seq: 7574, Ack: 2832, Len: 0

No.     Time           Source                Destination           Protocol Length Info
     77 0.898681804    192.168.86.250        192.168.86.47         TCP      60     [TCP Dup ACK 76#1] 80 → 48802 [ACK] Seq=7574 Ack=2832 Win=2048 Len=0

Frame 77: 60 bytes on wire (480 bits), 60 bytes captured (480 bits) on interface 0
Ethernet II, Src: 52:75:76:a7:f1:d9 (52:75:76:a7:f1:d9), Dst: IntelCor_e5:39:95 (0c:8b:fd:e5:39:95)
Internet Protocol Version 4, Src: 192.168.86.250, Dst: 192.168.86.47
Transmission Control Protocol, Src Port: 80, Dst Port: 48802, Seq: 7574, Ack: 2832, Len: 0

No.     Time           Source                Destination           Protocol Length Info
     78 0.898699746    192.168.86.47         192.168.86.250        TCP      54     48802 → 80 [RST] Seq=2832 Win=0 Len=0

Frame 78: 54 bytes on wire (432 bits), 54 bytes captured (432 bits) on interface 0
Ethernet II, Src: IntelCor_e5:39:95 (0c:8b:fd:e5:39:95), Dst: 52:75:76:a7:f1:d9 (52:75:76:a7:f1:d9)
Internet Protocol Version 4, Src: 192.168.86.47, Dst: 192.168.86.250
Transmission Control Protocol, Src Port: 48802, Dst Port: 80, Seq: 2832, Len: 0

No.     Time           Source                Destination           Protocol Length Info
     79 0.898711196    192.168.86.47         192.168.86.250        TCP      54     48802 → 80 [RST] Seq=2832 Win=0 Len=0

Frame 79: 54 bytes on wire (432 bits), 54 bytes captured (432 bits) on interface 0
Ethernet II, Src: IntelCor_e5:39:95 (0c:8b:fd:e5:39:95), Dst: 52:75:76:a7:f1:d9 (52:75:76:a7:f1:d9)
Internet Protocol Version 4, Src: 192.168.86.47, Dst: 192.168.86.250
Transmission Control Protocol, Src Port: 48802, Dst Port: 80, Seq: 2832, Len: 0
